ำดับ,ชื่อ,sku,บาร์,จำนวนรวม,ราคา
1,ยูสตาร์ เฟรชอัพเวลเว็ท ลิป #01 ยูสุ,23199,8856961231999,41491,27
2,ยูสตาร์ เฟรช อัพ ดิวอี้ ทินท์ #01,23242,8856961232422,6143,27
3,ยูสตาร์ เฟรชอัพเวลเว็ท ลิป #02 แอปเปิ้ล,23205,8856961232057,29166,27
4,ยูสตาร์ เฟรช อัพ ดิวอี้ ทินท์ #02,23252,8856961232521,12642,27
5,นอทิ ชิค ออล เดย์ อายไลเนอร์ เพ็น,22818,8856961228180,1465,22
6,ยูสตาร์ สไมลี่ย์เวิลด์ ซุปเปอร์ อายไลเนอร์,23184,8856961231845,,25
7,นอทิ ชิค อายบราว เพ็นซิล วิท ชาร์ปเพ็นเนอร์,22817,8856961228173,4392,18
8,ยูสตาร์ ซิกเนเจอร์ ทรี อิน วัน เพอร์เฟ็คท์ คอนซิลเลอร์,22872,8856961220580,2620,28
10,ยูสตาร์ แอนตี้ เมลาสมา ไบร์ทเทนนิ่ง ครีม,3080,8856961030806,5818,47
11,ยูสตาร์ สไมลี่ย์เวิลด์ จูสซี่ ทินท์ #01,23191,8856961231913,1906,25
12,ยูสตาร์ สไมลี่ย์เวิลด์ จูสซี่ ทินท์ #02,23192,8856961231920,1778,25
13,ยูสตาร์ ซิกเนเจอร์ เซลฟี่ เรดี้ สแนป ฟลัฟฟี่ ชีค #02,23165,8856961231654,2721,27
14,ยูสตาร์ จัสท์ ชายน์ ลิป บาล์ม #เรด เบอร์รี่,23112,8856961231128,10644,20
15,ยูสตาร์ คิวตี้ แมทท์ ลิปองค์ #01,22566,8856961225660,1324,18
16,ยูสตาร์ คิวตี้ แมทท์ ลิปองค์ #02,22567,8856961225677,489,18
17,ยูสตาร์ เฟมมี่ เฟมินีน ไฮยีน พีเอช บาลานซ์ สูตรอ่อนโยน,4071,8856961040713,,
18,ยูสตาร์ แมทท์ ล็อค ลิป คัลเลอร์ #01 สตาร์ดัส,B32361,8856961232613,16330,20
19,ยูสตาร์ แมทท์ ล็อค ลิป คัลเลอร์ #02 เชอร์รี่ นู้ด,B32362,8856961232620,8123,20
20,ยสตาร์ จัสท์ ชายน์ โกล์ว อาย พาเลท,23395,8856961232972,7399,35
21,ยูสตาร์ เฮฟวี่ แม็กซ์ แบล็ค ไลเนอรื,23437,8856961226674,17614,22
22,นอทิ ชิค ออล เดย์ อายไลเนอร์ เพ็น,23460,8856961233870,4903,27
23,ยูสตาร์ กลูต้า โกลว์ ออร่า บอดี้ เซรั่ม,4120,8856961041208,,
24,ยูสตาร์ แซสซี่ วิชวลลี เพอร์เฟ็คท์ อายบราว,23150,8856961221204,3600,12
25,โกลดื ดิ อินฟินิท บิวตี้ อายพาเลท #03(อายแชโดว์),22700,8856961227008,363,35
26,ยูสตาร์ พิงค์ไวท์ บอดี้ โลชั่น,4148,8856961041482,180,30
27,ยูสตาร์ แองจี้ ไอดอล วอท เดอะ พลัม สมูทเธสท์ ลิป ลัสเซียส #01,23426,8856961234266,2728,28
28,ยูสตาร์ แองจี้ ไอดอล วอท เดอะ พลัม สมูทเธสท์ ลิป ลัสเซียส #02,23427,8856961234273,2616,28
29,ยูสตาร์ ไอยาลู-เจลลี่ อะควา ไฮเดรทติ้ง เซรั่ม,3091,8856961030912,4591,42
30,ยูสตาร์ แองจี้ ไอดอล อุ๊ปส์ มาย ลิป คิสเอเบิล #01 เวรี่ คิสซี่,22993,8856961229934,5970,28
31,ยูสตาร์ พริตตี้ โปร อายบราว พาเลท,22735,8856961227350,1612,30
32,ยูสตาร์ แองจี้ไอดอล ดรีมเฟส เพอรืเฟ็คท์ลี่ รีทัช คอมแพ็ค ฟาวน์เดชั่น เอสพีเอฟ20 พีเอ #เอ็น 23 ผิวกลาง,B22784,8856961227848,630,47
33,ยูสตาร์ โลลี่ป๊อป ทู อิน วัน ซอฟท์ แมทท์ ลิป #01,23423,8856961234235,4147,28
34,ยูสตาร์ โลลี่ป๊อป ทู อิน วัน ซอฟท์ แมทท์ ลิป #02,23424,8856961234242,3419,28
35,โกลดื ดิ อินฟินิท บิวตี้ อายพาเลท #02(อายแชโดว์),B22699,8856961226995,729,35
36,โกลดื ดิ อินฟินิท บิวตี้ อายพาเลท #01(อายแชโดว์),B22698,8856961226988,295,35
37,ยูสตาร์ แองจี้ ไอดอล อุ๊ปสื มาย ลิป คิสเอเบิล #03 เฟลิร์ต มี คอรัล,22994,8856961229941,2690,28
38,ยูสตาร์ แองจี้ไอดอล ดรีมเฟส เพอรืเฟ็คท์ลี่ รีทัช คอมแพ็ค ฟาวน์เดชั่น เอสพีเอฟ20 พีเอ #เอ็น 23 ผิวกลาง,23415,8856961234150,977,47
39,ยูสตาร์ บิวตี้ นิสต้า โปร แมทท์ ลิควิด ลิป No.05 แครนเบอร์รี่ เรด,22501,8856961225011,1019,20
40,ยูสตาร์ บิวตี้ นิสต้า โปร แมทท์ ลิควิด ลิป No.04,22500,8856961225004,310,20
41,ยูสตาร์ บิวตี้ นิสต้า โปร แมทท์ ลิควิด ลิป No.02,22551,8856961225516,240,12
42,ยูสตาร์ สโนว์ อิท ออล บับเบิล ลิป  No.02,23350,8856961230596,232,22
43,ยูสตาร์ สโนว์ อิท ออล บับเบิล ลิป  No.04,23061,8856961230619,1176,22
44,ยูสตาร์ สโนว์ อิท ออล บับเบิล ลิป  No.05,23096,8856961230961,516,22
45,ยูสตาร์ โลลี่ป๊อป พลัมพิ่ง ลิป คัลเลอร์ #01 ,23325,8856961233245,2560,29
46,ยูสตาร์ โลลี่ป๊อป พลัมพิ่ง ลิป คัลเลอร์ #02,23324,8856961233252,3074,29
47,ยูสตาร์ จัสท์ ชายน์ ลิป บาล์ม เอสพีเอฟ 30+ พีเอ+ ลิปบาล์มบำรุงเนื้อนุ่ม สูตรป้องกันรังสี UVA/UVB,23108,8856961231081,3952,20
48,นอทิ ชิค ชิฟฟอน ลิปสติก -01 ป๊อปปี้ เรด,22825,8856961228258,4306,27
49,นอทิ ชิค ชิฟฟอน ลิปสติก -02 พีชชี่ นู้ด,22826,8856961228272,1271,27
50,นอทิ ชิค ชิฟฟอน ลิปสติก -03 แอปเปิ้ล พาย,22827,8856961228265,,
51,นอทิ ชิค ชีค ทู บลัชเชอร์ #02,22820,8856961228203,700,28
52,ยูสตาร์ สไมลี่ย์เวิลด์ ลิป คัลเลอร์ 01,23187,8856961231883,1607,30
53,นอทิ ชิค เมจิค แมททื คอมแพ้ค ฟาวน์เดชั่น เอสพีเอฟ 20 พีเอ++No. 02,22816,8856961228166,45,40
54,ยูสตาร์ วอลลุ่ม แอนด์ เคิร์ลรี่ แฮร์ เอสเซ้นท์,4155,8856961041154,882,40
55,นอทิชิค ครีมมี่ แมท์ ลิปสติก #02 โรซี่ เชอร์รี่,22829,8856961228296,,
56,โกลด์แบอรี่ ดิ อินฟินิท เจมส์ มัลติ อาย พาเลท อายชาโดว์ (01),22595,8856961225950,382,35
57,โกลด์แบอรี่ ดิ อินฟินิท เจมส์ มัลติ อาย พาเลท อายชาโดว์ (02),B22596,8856961225967,821,35
58,โกลด์แบอรี่ ดิ อินฟินิท เจมส์ สตาร์ดัส ชิมเมอร์,B22630,8856961226308,68,35
59,โกลด์แบอรี่ ดิ อินฟินิท เจมส์ มัลติ อาย พาเลท อายชาโดว์ (04),B22598,8856961225981,259,35
60,โกลด์แบอรี่ ดิ อินฟินิท เจมส์ คอนทัวร์ พาเลท (02),B22629,8856961226292,2768,35
61,ยูสตาร์ บิวตี้ นิสต้า แมทท์ แฟบูลัส ลิควิด ลิป  No.02,B22504,8856961225042,7881,20
62,ยูสตาร์ แซสซี่ สวีท แซสซี่ อายบราว แอนด์ เฉดดิ้ง คิท,22208,8856961222089,649,27
63,ยูสตาร์ แยูสตาร์ บิวตี้ นิสต้า โปร แมทท์ ลิปสติก No.01องจี้ ไอดอล แอรี่ ฟิท สติ๊ก 01,23071,8856961230718,2013,29
64,ยูสตาร์ แองจี้ ไอดอล แอรี่ ฟิท สติ๊ก 02,3072,8856961230725,2880,29
65,ยูสตาร์ บิวตี้ นิสต้า โปร แมทท์ ลิปสติก No.01 คาร์เนชั่น,22511,8856961225110,2123,20
66,ยูสตาร์ บิวตี้ นิสต้า โปร แมทท์ ลิปสติก No.02 พีชชี่,22512,8856961225127,2697,20
67,ยูสตาร์ บิวตี้ นิสต้า โปร แมทท์ ลิปสติก No.03 ทรู นู้ด,B22513,8856961225134,2170,20
68,ยูสตาร์ บิวตี้ นิสต้า โปร แมทท์ ลิปสติก No.04 บริค,22514,8856961225141,1699,20
69,ยูสตาร์ บิวตี้ นิสต้า โปร แมทท์ ลิปสติก No.05 สทาเลต,22515,8856961225158,1909,20
70,ยูสตาร์ แองจี้ ไอดอล สทันนิ่ง บราว โปรดูอัล อายบราว ,22787,8856961227879,1246,28
71,ยูสตาร์ โรแมนซ์ อัลตร้า ริช ลิปสติก 02,22737,8856961227374,344,20
72,ยูสตาร์ แองจี้ ไอดอล โปร ดรออิ้งซอฟท์ บราว #ชิค บราวน์,23006,8856961230060,2332,29
73,ยูสตาร์ ซุปเปอร์ ไฮยา-คอลลาเจน แม็กซ์ เซรั่ม,3067,8856961030677,1002,38
74,ยูสตาร์ ซิกเนเจอร์ แม็กซ์ คัฟเวอร์ ทู อิน วัน ไพรเมอร์ แอนด์ มาสคาร่า ไฟเบอร์,23421,8856961234211,800,38
75,ยูสตาร์ ซิดเนเจอร์ ออล คอนซิลเลอร์,23236,8856961232361,,
76,ยูสตาร์ สกินนู้ด 2 อิน 1 อายบราว,23391,8856961233092,4384,22
77,ยูสตาร์ ไฮยา เอมพื ซีด ออยล์ ไบโอแอคทีฟ เซรั่ม,0308703086,8856961030868,2235,38
78,ยูสตาร์ โลลี่ป๊อป ทู อิน วัน สลิม เบลนเดอร์ บราว #เนเซอรัล บราวน์,23328,8856961233283,1812,29
79,ยูสตาร์ ชายนิ่ง สตาร์ แดสลิ่ง วอเตอร์ ปรู๊ฟ อายบราว,23087,8856961230879,1368,22
80,ยูสตาร์ ชายนิ่ง สตาร์ คิส แกลม โกลวื ลิป No.02,23085,8856961230855,6347,20
81,อินทูอิท ฮันนี่ เลิฟเวอร์ คัลเลอร์ ทิ้นท์,HLT 02,8858000021950,189,16
82,อินทูอิท ฮันนี่ เลิฟเวอร์ คัลเลอร์ ทิ้นท์,HLT 03,8858000021967,1095,16
83,อินทูอิท ฮันนี่ เลิฟเวอร์ คัลเลอร์ ทิ้นท์,HLT 04,8858000021974,8700,16
84,อินทูอิท ฮันนี่ เลิฟเวอร์ คัลเลอร์ ทิ้นท์,HLT 05,8858000021981,10282,16
85,อินทูอิท ฮันนี่ เลิฟเวอร์ คัลเลอร์ ทิ้นท์,HLT 06,8858000021998,3810,16
86,ยูสตาร์ แองจี้ ไอดอล ดูโอ ทินท์ บาล์ม,23271,8856961232712,2086,26
87,ยูสตาร์ นีโอ มัลติ อาย คัลเลอร์ พาเลท,23246,8856961232460,3410,42
88,ยูสตาร์ นีโอ โปร อายแอนด์ บลัชร์ พาเลท,23329,8856961233290,9135,36
89,ยูสตาร์ มินนี่ วันเตอร์ วิช ซอฟต์ แมทท์ ลิควิด ลิป 02,22454,8856961224540,1260,20
90,ยูสตาร์ มินนี่ วันเตอร์ วิช ซอฟต์ แมทท์ ลิควิด ลิป 07,22457,8856961224595,1045,20
91,ยูสตาร์ มินนี่ วันเตอร์ ป๊อป ซอฟต์ แมทท์ ลิควิด ลิป 03,22465,8856961224656,752,20
92,ยูสตาร์ มินนี่ วันเตอร์ ป๊อป ซอฟต์ แมทท์ ลิควิด ลิป 04,22466,8856961224663,1773,20
93,ยูสตาร์ มินนี่ วันเตอร์ ป๊อป ซอฟต์ แมทท์ ลิควิด ลิป 06,22468,8856961224687,1332,20
94,ยูสตาร์ มินนี่ วันเตอร์ ป๊อป ซอฟต์ แมทท์ ลิควิด ลิป 07,22469,8856961224694,216,20
95,ยูสตาร์ มินนี่ วันเตอร์ ป๊อป ซอฟต์ แมทท์ ลิควิด ลิป 08,22470,8856961224700,1356,20
96,DARK CIRCLE Corrector 02,IN 2IT02,8858000021615,1369,27
97,DARK CIRCLE Corrector 03,IN 2IT 03,8858000021622,7700,27
98,ยูสตาร์ ชายนิ่ง สตาร์ คิส แกลม โกลว์ ลิป No.01,23084,8856961230848,12410,20
99,ยูสตาร์ ซิกเนเจอร์ ทรีโอ อายบราว,23409,8856961234099,7190,25
100,ยูซี วีแกน ทูอินวัน เวลเว็ท ลิป #01 จัสท์ คอรัล,23076,8856961230763,4427,27
101,ยูซี วีแกน ทูอินวัน เวลเว็ท ลิป #02 ,23077,8856961230770,5970,27
102,ยูซี วีแกน ทูอินวัน เวลเว็ท ลิป #03 เทนเดอร์คิส,23079,8856961230794,5877,27
103,โกลด์เบอร์รี่ ดิ อนฟินิท เจมส์ ออมเบร เฟส คัลเลอร์ 03,22603,8856961226032,228,35
104,โกลด์เบอร์รี่ ดิ อนฟินิท เจมส์ ออมเบร เฟส คัลเลอร์ 02,22602,8856961226025,298,35
105,โกลด์เบอร์รี่ ดิ อนฟินิท เจมส์ ออมเบร เฟส คัลเลอร์ 01,22601,8856961226018,595,35
106,โกลด์เบอร์รี่ ดิ อนฟินิท เจมส์ ออมเบร เฟส คัลเลอร์ 04,22604,8856961226049,980,35
107,โกลด์เบอร์รี่ ดิ อนฟินิท เจมส์ ออมเบร เฟส คัลเลอร์ 05,22605,8856961226056,434,35
108,ยูสตาร์ ชูชู  บราว ควิกกี้,22589,8856961225899,546,27
109,ยูสตาร์ ซิกเนเจอร์ ทรีโอ อายบราว,23095,8856961218211,923,28
110,ยูสตาร์ ไวท์ แอนด์ สมูท คลีนซิ่ง โฟม,3107,8856961031070,5608,32
111,ยูสตาร์ มินนี่ วันเตอร์ วิช ซอฟต์ แมทท์ ลิควิด ลิป 10,22462,8856961224625,1615,20
112,ยูสตาร์ มินนี่ วันเตอร์ วิช ซอฟต์ แมทท์ ลิควิด ลิป 04,22456,8856961224564,1412,20
113,ยูสตาร์ มินนี่ วันเตอร์ วิช ซอฟต์ แมทท์ ลิควิด ลิป 03,22455,8856961224557,635,20
114,ยูสตาร์ อาย แคนดี้ วัน ช๊อต อาย พาเลท,23237,8856961232378,1127,26
115,ยูสตาร์ พลัม อัพ ซอฟต์ แมทท์ ลิปสติก ครีม 02 สกาเลต เรด,23204,8856961223802,1152,26
116,ยูสตาร์ พลัม อัพ ซอฟต์ แมทท์ ลิปสติก ครีม 03 คอรัล พีช,23203,8856961223796,1660,26
117,ยูสตาร์ บลูมมิ่ง ฟลาวเวอร์ แบล็ค ไลเนอร์ เพ็น,23451,8856961224960,17111,21
118,ยูสตาร์ ซิกเนเจอร์ แม็กซ์ คัฟเวอร์ มู้ด แมทท์ ลิป,23443,8856961234433,3370,32
119,ยูสตาร์ สกิน มู้ด ทรี อิน วัน ลิฟ บราว แอนด์ คอนทัวร์ พาเลท 3 ni 1,23321,8856961233214,1931,36
120,ยูสตาร์ ชูชู  บราว ควิกกี้,23026,8856961230268,1325,28
121,ยูสตาร์ แซสซี่ สวีท เมจิค เบลอ พาวเดอร์ แพ็ค 01 ,22273,8856961222713,204,27
122,ยูสตาร์ ซิกเนเจอร์ เซลฟี่ รีเฟลกชั่น ลิปสติก 01,22295,8856961223,,
123,ยูสตาร์ ซิกเนเจอร์ เซลฟี่ รีเฟลกชั่น ลิปสติก 02,22296,8856961223017,2386,10
124,ยูสตาร์ ซิกเนเจอร์ เซลฟี่ รีเฟลกชั่น ลิปสติก 03,22297,8856961222973,729,10
125,ยูสตาร์ ซิกเนเจอร์ เซลฟี่ รีเฟลกชั่น ลิปสติก 04,22298,8856961222980,400,10
126,ยูสตาร์ ซิกเนเจอร์ เซลฟี่ รีเฟลกชั่น ลิปสติก 05,22299,8856961222997,528,10
127,ยูสตาร์ โปรเปปไทด์ x2 ,3039,8856961030394,2495,36
128,ยูสตาร์ พรี-โพรไบโอติกส์ ดับเบิล อินเทนซีฟ รีแพร์ เซรั่ม,0304303052,8856961030431,3260,36
129,PORJA #01,PORJA #01,8857128091043,2080,18
130,PORJA #02,PORJA #02,8857128091043,4158,18
131,PORJA #03,PORJA #03,8857128091043,2085,18
132,นีโอ แอนดี้ แอค คอมแพ็ค ,23247,8856961232477,12607,41
133,ยูสตาร์ เลิฟ แอดดิก เฟอรืฟูม เซ็ท,5019,8856961050194,468,45
134,ยูสตาร์ คิส มี มอร์ เพอร์ฟูม เซ็ท,5053,8856961050538,216,40
135,ยูสตาร์ ไบร์ทเทนนิ่ง ชาวเวอร์ ครีม-ซีเครท ฟลอรัล,4152,8856961041529,371,37
136,ยูสตาร์ ไบร์ทเทนนิ่ง ชาวเวอร์ ครีม-สวีท บลอสซั่ม,45151,8856961041499,1472,37
137,มิสทีน โกท มิ้ลค์ เอ็กซ์ตร้า มายด์ โลชั่น,36228,8859178710516,2573,30
138,ยูสตาร์ คาเวียร์ไลม์ ไวท์ แอนด์ ไบร์ท บอดี้ ซั่ม พลัส มอยส์เจอร์ บีดส์,40728,8856961019542,386,30
139,ยูสตาร์ สไมลี่ยืเวิลด์ ไบร์ท คัฟเวอร์ คอมแพ็คฟาวนืเดชั่น 25 พีเอ +++ #วอร์ม เบจ,23197,8856961231975,200,42
140,ยูสตาร์ ซิกเนเจอร์ ทรี อิน วัน เพอร์เฟค สไตล์ลัส อายแชโดว์,23018,8856961230183,329,28
141,บูสเต้ มัลติวิตามิน ไมเซล่า แชมพู,623080,8852660630804,156,30
142,ยูสตาร์ ซีบรีซ รีเฟรชชิ่ง ชาวเวอร์ ครีม,4066,8856961040652,19,30
143,ยูสตาร์ แองจี้ ไอดอล คัฟเวอรื สมูท 24 ฮาว คอมแพ็ค ฟาวน์เดชั่น เอสพีเอฟ25พีเอ++ ,23207,8856961230350,,
144,ยูสตาร์ มินนี่ วันเดอร์ ดรีม คอมฟอร์ท ลิปสติก NO. 01,22425,8856961224281,1594,20
145,โกลด์แบอรี่ ดิ อินฟินิท เจมส์ คอนทัวร์ พาเลท (01),B22628,8856961226285,1964,35
146,บูสเต้ มัลติวิตามิน บอริชชิ่ง คอนดิชั่นเนอร์ (ครีมนวด),623082,8852660630828,384,30
147,โกลว์เบอร์รี่ ดิ อินฟินิท เจมส์ โปร ลิป พาเลท #01,B22624,8856961226247,1028,35
148,โกลว์เบอร์รี่ ดิ อินฟินิท เจมส์ โปร ลิป พาเลท #02,B22625,8856961226254,2571,35
149,โกลว์เบอร์รี่ ดิ อินฟินิท เจมส์ โปร ลิป พาเลท #03,B22626,8856961226261,2399,35
150,โกลว์เบอร์รี่ ดิ อินฟินิท เจมส์ โปร ลิป พาเลท #04,B22627,8856961226278,2535,35
151,ยูสตาร์ แองจี้ไอดอล มัลติ พาเลท 3 in 1,23099,8856961230992,513,20
152,ยูสตาร์ ซิกเนเจอร์ แม็กซ์ คัฟเวอร์ อายไลเนอร์,23455,8856961234556,3423,27
153,ยูสตาร์ ซิกเนเจอร์ วอลลุ่มมาสคาร่า,23438,8856961234389,4706,37
154,ยูสตาร์ ซิกเนเจอร์ แม็กซ์ คัฟเวอร์ คัลเลอร์แกรมพาเลท 6 ช่อง,23418,8856961234181,3017,42
155,บูสเต้ มัลติวิตามิน ไวท์เทนนิ่ง บอดดี้ โลชั่น (บำรุงผิวกาย),623078,8852660630781,39,30
156,อินทูอิท เฟส ป๊อปปั้น เบลอ เพรส พาวเตอร์ #01,IN 2 Tt# 1,8858000022452,597,39
157,ยูสตาร์ สไมลี่ย์เวิลด์ ลิป คัลเลอร์ 02,23188,8856961231876,800,31
158,ยูสตาร์ สไมลี่ย์เวิลด์ ออโต้ อายบราว คิ้วเริ่ด ,23196,8856961231968,900,22
159,ยูสตาร์ มินนี่ วันเตอร์ วิช ซอฟต์ แมทท์ ลิควิด ลิป 09,23222,8856961224519,849,20
160,ลอร่า สกิน แบล็ค เพิร์ลแอดวานซ์ บูสเตอร์ เซรั่ม, ลอร่า สกิน,,7206,25
161,อินทูอิท เฟส ป๊อปปั้น เบลอ เพรส พาวเตอร์ #03,IN 2 Tt#3,8858000022476,4325,39
162,อินทูอิท เฟส ป๊อปปั้น เบลอ เพรส พาวเตอร์ #04,IN 2 Tt#4,8858000022674,813,39
163,ยูสตาร์ วิตซี ซูเปอร์ เซรั่ม,3072,8856961030721,2885,39
164,ยูสตาร์ ซุปเปอร์ ฟิลเลอร์ เฟิร์ส เซรั่ม บูสเตอร์,3094,8856961030936,1858,38
165,ยูสตาร์ โลลี่ป๊อป ทู อิน วัน ออโต้ บราว คาร่า,23549,8856961232798,1979,28
166,บูสเตอร์ มัลติวิตามิน พาวเดอร์ แป้งฝุ่นหน้า และผิวกาย 180 กรัม,Powder 180,8852660629938,228,27
167,ยูสตาร์ ไบร์ท คัฟเวอร์ คอลเลคชั่น่ ซูเปอร์ พาวเดอร์ แอนด์ ซีซี ครีม,5024,8856961050248,,
